streamer,title,link
Hana,"(Birthday Stream) Talking, Eating, and Browsing #Hananniversary !【NIJISANJI ID | Hana Macchia】",https://www.youtube.com/watch?v=BgoLZqap39k&t=11640
Hana,"(Fall Guys) alive game, absolutely breathing and pulsating with live【NIJISANJI ID | Hana Macchia】",https://www.youtube.com/watch?v=aM_NyrlzpPo&t=7770
Tomoshika,ENGLISH STREAM BY JAPANESE,https://www.youtube.com/watch?v=qQ1_q550Ukw&t=1680
Uto,Sorry. Horror games scare me more than the dentist. [Visage],https://www.youtube.com/watch?v=BlAwbkw_gsA&t=2970
Uto,SuperChat Thank you♡,https://www.youtube.com/watch?v=mB10sJ_fbuw&t=4770
Uto,Try to convert English to Japanese!,https://www.youtube.com/watch?v=ltnq_HsyAbc&t=5220
